{
  "id": "sy-example-transport-location-status-2026-07-08-example-source",
  "locationId": "sy-example-transport-location",
  "observedStatus": "unknown",
  "statusAsOf": "2026-07-08",
  "countryPair": "Example - Syria",
  "sourceNames": ["Example Border Crossing"],
  "statusNote": "Example dated status observation.",
  "sourceIds": ["example-source"],
  "sourceReferences": [
    {
      "sourceId": "example-source",
      "sourceRecordId": "example-status-2026-07-08",
      "sourceRecordDate": "2026-07-08",
      "accessedAt": "2026-07-08T00:00:00.000Z"
    }
  ],
  "sourceStatus": "released"
}
